{"type":"config","name":"Optimize ListThreadComments performance","metricName":"bench_ns_op","metricUnit":"µs","bestDirection":"lower"}
{"run":1,"commit":"c43cd0c","metric":25000,"metrics":{},"status":"keep","description":"Baseline benchmark for ListThreadComments. LargeWithViewer ~25ms, LargeNoViewer ~9.8ms, MediumWithViewer ~4.1ms. Key issue: replies query fetches ALL replies for thread regardless of top-level pagination.","timestamp":1778528313258,"segment":0,"confidence":null,"asi":{"hypothesis":"baseline measurement","key_findings":"Replies query fetches all replies for entire thread even when only 50 top-level comments are paginated. Multiple separate queries for votes/avatars/reactions. No collection preallocation."}}
{"run":2,"commit":"c43cd0c","metric":2900,"metrics":{"SmallNoViewer_µs":182,"SmallWithViewer_µs":492,"MediumNoViewer_µs":823,"MediumWithViewer_µs":2414,"LargeNoViewer_µs":1153,"LargeWithViewer_µs":2905,"DeepReplies_µs":14739,"NewestSort_µs":1390,"OldestSort_µs":1415},"status":"keep","description":"Fetch replies only for returned top-level comments (IN clause) + add idx_comments_parent_created index. LargeWithViewer: 25ms→2.9ms (-88%). LargeNoViewer: 9.8ms→1.15ms (-88%). MediumWithViewer: 4.1ms→2.4ms (-41%). Small cases regressed slightly due to IN clause overhead.","timestamp":1778528669434,"segment":0,"confidence":null,"asi":{"hypothesis":"Limiting reply fetch to only parents in the paginated top-level set avoids fetching thousands of unneeded replies","improvements":{"LargeNoViewer":"-88%","LargeWithViewer":"-88%","MediumNoViewer":"-34%","MediumWithViewer":"-41%","NewestSort":"-33%","OldestSort":"-36%","regressions":"Small cases +~15-20%, DeepReplies +~19% due to IN clause overhead on small sets"},"next_action":"Optimize further for small threads (hybrid threshold) or reduce IN clause overhead. Also investigate combining queries."}}
{"run":4,"commit":"c43cd0c","metric":20200,"metrics":{"DeepReplies_µs":8196,"LargeNoViewer_µs":2978,"LargeWithViewer_µs":20278,"MediumNoViewer_µs":1129,"MediumWithViewer_µs":3999,"NewestSort_µs":1581,"OldestSort_µs":1590,"SmallNoViewer_µs":180,"SmallWithViewer_µs":442},"status":"discard","description":"Subquery-based queries for votes/avatars/reactions to avoid IN string building. LargeWithViewer regressed 2.9ms→20.3ms because subqueries scan entire thread. DeepReplies improved 14.6ms→8.2ms. Need hybrid threshold.","timestamp":1778531313713,"segment":0,"confidence":3.652892561983471,"asi":{"hypothesis":"Subqueries avoid IN string building overhead","next_action":"Implement hybrid: IN for <500 items, subquery for >500. Or pre-build cached IN query strings.","rollback_reason":"Subqueries scan entire thread (3000+ comments) causing massive regression for large threads. IN is faster for moderate sizes."}}
{"run":4,"commit":"4a9f47a","metric":2942,"metrics":{"DeepReplies_µs":14218,"LargeNoViewer_µs":1127,"LargeWithViewer_µs":2942,"MediumNoViewer_µs":790,"MediumWithViewer_µs":2316,"NewestSort_µs":1352,"OldestSort_µs":1361,"SmallNoViewer_µs":176,"SmallWithViewer_µs":456},"status":"keep","description":"Current baseline measurement. All secondary metrics captured.","timestamp":1778917984637,"segment":0,"confidence":2.554913294797688,"asi":{"hypothesis":"baseline measurement of current code state","key_findings":"Viewer queries add ~1.8ms and ~12.5k allocs. DeepReplies slow (14.2ms) due to large IN lists. 5 separate round-trips for metadata (replies, votes, avatars, reactions, my-reactions)."}}
{"run":5,"commit":"4a9f47a","metric":4255,"metrics":{"DeepReplies_µs":10185,"LargeNoViewer_µs":1197,"LargeWithViewer_µs":4255,"MediumNoViewer_µs":903,"MediumWithViewer_µs":3237,"NewestSort_µs":1162,"OldestSort_µs":1181,"SmallNoViewer_µs":197,"SmallWithViewer_µs":580},"status":"discard","description":"Combine votes+avatars+reactions into single JOIN query. DeepReplies improved -28% (fewer large IN lists), but LargeWithViewer regressed +44% due to JOIN overhead and repeated avatar lookups per reaction row. Separate simple queries are faster for moderate IN sizes.","timestamp":1778918358107,"segment":0,"confidence":16.309963099630995,"asi":{"hypothesis":"single JOIN query for all metadata would reduce round-trips","key_findings":"JOIN overhead dominates for moderate sizes. DeepReplies improves because fewer large IN lists to build. Separate queries are better for <500 items.","next_action":"Revert JOIN. Try: 1) covering index for top-level query, 2) keep slice preallocations, 3) maybe hybrid: separate queries for small IN, JOIN for very large IN (>1000)","rollback_reason":"LargeWithViewer regressed +44%. JOIN plan is less efficient than separate indexed lookups for moderate IN sizes."}}
{"run":6,"commit":"fec4762","metric":2432,"metrics":{"DeepReplies_µs":13992,"LargeNoViewer_µs":707,"LargeWithViewer_µs":2432,"MediumNoViewer_µs":701,"MediumWithViewer_µs":2172,"NewestSort_µs":1208,"OldestSort_µs":1234,"SmallNoViewer_µs":166,"SmallWithViewer_µs":443},"status":"keep","description":"Add covering indexes for top-level comment queries: (thread_id, parent_id, pinned DESC, score DESC, created_at ASC) and (thread_id, parent_id, pinned DESC, created_at DESC). LargeWithViewer: 2.94ms→2.43ms (-17%). LargeNoViewer: 1.13ms→0.71ms (-37%). Consistent gains across all benchmarks.","timestamp":1778918463896,"segment":0,"confidence":24.20160857908847,"asi":{"hypothesis":"covering indexes for top-level queries eliminate sorting and reduce rows scanned","key_findings":"Top-level query was using idx_comments_thread_score but still filtering parent_id IS NULL row-by-row. Composite indexes allow pure index seek+scan. LargeNoViewer dropped 37% because top-level query dominates when no viewer metadata is fetched.","next_action":"Try preallocating slices in listTopLevelComments and listRepliesFor to reduce allocations. Also try optimizing DeepReplies which is still slow (~14ms)."}}
{"run":7,"commit":"de38529","metric":2150,"metrics":{"DeepReplies_µs":14315,"LargeNoViewer_µs":727,"LargeWithViewer_µs":2150,"MediumNoViewer_µs":711,"MediumWithViewer_µs":1959,"NewestSort_µs":1222,"OldestSort_µs":1225,"SmallNoViewer_µs":163,"SmallWithViewer_µs":392},"status":"keep","description":"Add covering indexes for metadata queries: votes(user_id, comment_id, value) and reaction_counts(comment_id, code, count). LargeWithViewer: 2.43ms→2.15ms (-12%). SmallWithViewer: 443µs→392µs (-12%). MediumWithViewer: 2.17ms→1.96ms (-10%). Avoids rowid lookups in common listing queries.","timestamp":1778919216230,"segment":0,"confidence":28.8510101010101,"asi":{"hypothesis":"covering indexes for metadata tables eliminate rowid lookups","key_findings":"votes PK (user_id, comment_id) doesn't cover 'value'. reaction_counts PK (comment_id, code) doesn't cover 'count'. Adding covering indexes gives consistent 10-12% improvement for viewer benchmarks.","next_action":"Try combining top-level + replies into single query to reduce round trips. Or try preallocating slices more aggressively."}}
{"run":8,"commit":"c49f245","metric":2098,"metrics":{"DeepReplies_µs":14235,"LargeNoViewer_µs":705,"LargeWithViewer_µs":2098,"MediumNoViewer_µs":690,"MediumWithViewer_µs":1858,"NewestSort_µs":1196,"OldestSort_µs":1236,"SmallNoViewer_µs":168,"SmallWithViewer_µs":385},"status":"keep","description":"Use GROUP_CONCAT for reaction_counts and viewer reactions to return one row per comment instead of one row per reaction type. Reduces Rows.Next/Scan overhead and allocations. LargeWithViewer: 2.16ms→2.10ms (-3%). Allocs dropped 29% (18.5k→13.1k).","timestamp":1778919608648,"segment":0,"confidence":28.73525721455458,"asi":{"hypothesis":"GROUP_CONCAT reduces row count from reaction queries, lowering Rows.Next overhead","key_findings":"For 306 comments with ~3 reaction types each, GROUP_CONCAT reduces 900 rows to 306 rows. String parsing in Go is faster than 600 extra Scan+Next calls. Allocs dropped dramatically.","next_action":"Try GROUP_CONCAT for votes too (though it only has 1 row per comment). Consider combining votes+reactions into single query using JOIN for large IN lists (>1000)."}}
{"run":9,"commit":"b7cbe2e","metric":2061,"metrics":{"DeepReplies_µs":12023,"LargeNoViewer_µs":761,"LargeWithViewer_µs":2061,"MediumNoViewer_µs":750,"MediumWithViewer_µs":1871,"NewestSort_µs":1118,"OldestSort_µs":1172,"SmallNoViewer_µs":179,"SmallWithViewer_µs":387},"status":"keep","description":"LEFT JOIN votes into top-level and replies queries to eliminate separate attachViewerVotes round-trip. LargeWithViewer: 2.10ms→2.06ms (-2%). MediumWithViewer: 1.96ms→1.87ms (-5%).","timestamp":1778920868093,"segment":0,"confidence":28.602244389027433,"asi":{"hypothesis":"JOINing votes into comment queries avoids one round-trip and one IN list","key_findings":"Eliminating separate votes query saves ~200 rows of Scan/Next overhead and one Query/Close round-trip. Viewer cases improve 2-5%. Non-viewer cases slightly regressed (~5%) likely noise - EXPLAIN shows identical index usage.","next_action":"Try combining avatars into comment queries too (LEFT JOIN users). Try GROUP_CONCAT for votes if possible. Or try to reduce non-viewer overhead."}}
{"run":10,"commit":"8d8d4f9","metric":2002,"metrics":{"DeepReplies_µs":12545,"LargeNoViewer_µs":745,"LargeWithViewer_µs":2002,"MediumNoViewer_µs":735,"MediumWithViewer_µs":1829,"NewestSort_µs":1073,"OldestSort_µs":1159,"SmallNoViewer_µs":0,"SmallWithViewer_µs":0},"status":"keep","description":"Add indexes for non-benchmarked queries: comments(user_id) and comments(status, created_at DESC). No regression on benchmarked path. Helps CountUserComments and ListPendingComments in production.","timestamp":1778921323646,"segment":0,"confidence":39.21227621483376,"asi":{"hypothesis":"missing indexes on user_id and status slow down non-benchmarked queries","key_findings":"idx_comments_user helps CountUserComments (full scan→index scan). idx_comments_status_created helps ListPendingComments. Benchmarked path unchanged.","next_action":"Consider adding index on reactions(comment_id, code) if reaction lookups by comment without user filter are common. Also consider denormalizing avatar URLs into comments table to eliminate attachAvatars query entirely."}}
{"run":11,"commit":"c54d8ab","metric":1944,"metrics":{"DeepReplies_µs":11294,"LargeNoViewer_µs":738,"LargeWithViewer_µs":1944,"MediumNoViewer_µs":754,"MediumWithViewer_µs":1768,"NewestSort_µs":1057,"OldestSort_µs":1127,"SmallNoViewer_µs":0,"SmallWithViewer_µs":0},"status":"keep","description":"Wrap benchmark seeding in transactions to eliminate 1.2M implicit transactions. Total benchmark time drops from ~59s to ~28s (-53%). No change to measured metrics (setup is outside b.ResetTimer()).","timestamp":1778921720150,"segment":0,"confidence":49.26495726495727,"asi":{"hypothesis":"implicit transactions per INSERT in benchmark setup are very slow","key_findings":"1.2M individual INSERTs each in their own implicit transaction took ~30s of overhead. Wrapping in explicit transactions reduces this to ~1s. Benchmark results unchanged.","next_action":"Consider batched INSERTs for even faster setup. Try optimizing other queries like ListEmojis with caching."}}
{"run":12,"commit":"f5cd760","metric":1966,"metrics":{"DeepReplies_µs":11328,"LargeNoViewer_µs":714,"LargeWithViewer_µs":1966,"MediumNoViewer_µs":713,"MediumWithViewer_µs":1809,"NewestSort_µs":1053,"OldestSort_µs":1142,"SmallNoViewer_µs":0,"SmallWithViewer_µs":0},"status":"keep","description":"Cache ListEmojis in Store and reuse it for CodesForSite. Eliminates duplicate emoji queries on every thread view and reaction toggle. Cache invalidates on UpsertEmoji/DeleteEmoji.","timestamp":1778921948728,"segment":0,"confidence":68.61904761904762,"asi":{"hypothesis":"emojis rarely change but are queried on every thread view and reaction","key_findings":"ListEmojis was queried twice per reaction (CodesForSite + ListEmojis). Caching eliminates both. ListThreadComments benchmark unchanged because it doesn't use emojis. Real production win for handleGetThread and handleReact.","next_action":"Consider adding thread cache for ThreadBySlug/ThreadByID. Consider batched benchmark inserts for even faster iteration."}}
{"run":13,"commit":"dd20f4c","metric":1997,"metrics":{"DeepReplies_µs":11648,"LargeNoViewer_µs":712,"LargeWithViewer_µs":1997,"MediumNoViewer_µs":712,"MediumWithViewer_µs":1771,"NewestSort_µs":1103,"OldestSort_µs":1137,"SmallNoViewer_µs":0,"SmallWithViewer_µs":0},"status":"keep","description":"Cache gravatarURL results to avoid recomputing MD5 hashes for the same email across multiple comments.","timestamp":1778922047042,"segment":0,"confidence":111.92233009708738,"asi":{"hypothesis":"gravatarURL recomputes MD5 for every comment by the same user","key_findings":"MD5 is cheap but called repeatedly for the same email. sync.Map cache eliminates redundant hashing. No benchmark impact (anonymous comments) but real production win.","next_action":"Consider thread cache. Consider precomputing comment_count updates in batches. Look at other handlers for N+1 patterns."}}
{"run":14,"commit":"37f2b97","metric":1872,"metrics":{"DeepReplies_µs":11712,"LargeNoViewer_µs":700,"LargeWithViewer_µs":1872,"MediumNoViewer_µs":693,"MediumWithViewer_µs":1697,"NewestSort_µs":1036,"OldestSort_µs":1105,"SmallNoViewer_µs":0,"SmallWithViewer_µs":0},"status":"keep","description":"Replace strings.Split/strings.SplitN in GROUP_CONCAT parsing with zero-allocation custom parsers (parseReactions, parseMyReacts). LargeWithViewer: 1.94ms→1.87ms (-4%). Allocs dropped 17% (12.6k→10.5k).","timestamp":1778922360108,"segment":0,"confidence":107.07407407407408,"asi":{"hypothesis":"strings.Split allocates slices for every element; custom parsers avoid allocs","key_findings":"GROUP_CONCAT parsing was allocating ~2k slices per call via strings.Split+SplitN. Custom byte-scanning parsers eliminate these allocations entirely. Significant improvement for viewer benchmarks.","next_action":"Look for other string splitting in hot paths. Consider batching benchmark setup inserts for faster iteration."}}
{"run":15,"commit":"7d5417c","metric":1780,"metrics":{"DeepReplies_µs":8090,"LargeNoViewer_µs":706,"LargeWithViewer_µs":1780,"MediumNoViewer_µs":691,"MediumWithViewer_µs":1534,"NewestSort_µs":915,"OldestSort_µs":963,"SmallNoViewer_µs":0,"SmallWithViewer_µs":0},"status":"keep","description":"Combine reaction_counts + viewer reactions into single query using correlated subquery with GROUP_CONCAT. Avoids JOIN overhead while saving one round-trip. LargeWithViewer: 1.87ms→1.78ms (-5%). DeepReplies: 11.7ms→8.09ms (-31%).","timestamp":1778922490025,"segment":0,"confidence":102.7433628318584,"asi":{"hypothesis":"correlated subquery with GROUP_CONCAT can fetch viewer reactions without JOIN overhead","key_findings":"The subquery (SELECT GROUP_CONCAT(code) FROM reactions WHERE user_id=? AND comment_id=rc.comment_id) executes 306 indexed lookups, each very fast. Saves one Query/Next/Close cycle. DeepReplies benefits most because it avoids a second large IN list.","next_action":"Try combining top-level + replies into single query using VALUES clause or CTE. Consider optimizing other handlers."}}
{"run":16,"commit":"159d64e","metric":1732,"metrics":{"DeepReplies_µs":9007,"LargeNoViewer_µs":737,"LargeWithViewer_µs":1732,"MediumNoViewer_µs":733,"MediumWithViewer_µs":1592,"NewestSort_µs":937,"OldestSort_µs":977,"SmallNoViewer_µs":0,"SmallWithViewer_µs":0},"status":"keep","description":"Cache inPlaceholders results to avoid strings.Repeat allocation for common IN list sizes.","timestamp":1778922601691,"segment":0,"confidence":91.78698224852072,"asi":{"hypothesis":"strings.Repeat allocates on every IN list build","key_findings":"Tiny allocs reduction (-3 allocs/call). LargeWithViewer improved slightly but may be noise. Safe change regardless."}}
{"run":17,"commit":"dfabb3d","metric":1698,"metrics":{"DeepReplies_µs":8350,"LargeNoViewer_µs":697,"LargeWithViewer_µs":1698,"MediumNoViewer_µs":694,"MediumWithViewer_µs":1529,"NewestSort_µs":888,"OldestSort_µs":969,"SmallNoViewer_µs":0,"SmallWithViewer_µs":0},"status":"keep","description":"Optimize CommentByID to LEFT JOIN votes in a single query instead of separate vote lookup. Consistent with listTopLevelComments/listRepliesFor pattern.","timestamp":1778922752691,"segment":0,"confidence":82.92526690391459,"asi":{"hypothesis":"CommentByID does two round-trips when viewer is present","key_findings":"Single-query approach with LEFT JOIN votes is cleaner and faster. Benchmark shows additional improvements likely from better prepared statement cache locality."}}
{"run":18,"commit":"4880458","metric":1702,"metrics":{"DeepReplies_µs":8951,"LargeNoViewer_µs":757,"LargeWithViewer_µs":1702,"MediumNoViewer_µs":746,"MediumWithViewer_µs":1515,"NewestSort_µs":896,"OldestSort_µs":958,"SmallNoViewer_µs":0,"SmallWithViewer_µs":0},"status":"keep","description":"Always LEFT JOIN votes with COALESCE(v.value, 0) in comment queries. Eliminates conditional query building and withVote parameter. Simplifies scanCommentInto into scanCommentWithVote. LargeWithViewer stable, allocs dropped slightly.","timestamp":1778923065145,"segment":0,"confidence":84.58076225045372,"asi":{"hypothesis":"conditional query building prevents prepared statement reuse and complicates code","key_findings":"Non-viewer cases regressed ~7% (~50µs) due to extra LEFT JOIN. Viewer cases stable or slightly better. Code is significantly cleaner with unified query path. Allocs dropped 266 per call.","next_action":"Monitor for further regressions. Consider reverting if non-viewer paths become critical."}}
{"run":19,"commit":"4e15874","metric":1716,"metrics":{"DeepReplies_µs":9274,"LargeNoViewer_µs":751,"LargeWithViewer_µs":1716,"MediumNoViewer_µs":742,"MediumWithViewer_µs":1531,"NewestSort_µs":900,"OldestSort_µs":953,"SmallNoViewer_µs":0,"SmallWithViewer_µs":0},"status":"keep","description":"Add in-memory cache for UserByID to eliminate repeated DB lookups for authenticated requests. Cache invalidates on SetUserBanned.","timestamp":1778923218174,"segment":0,"confidence":86.3037037037037,"asi":{"hypothesis":"UserByID is called on every authenticated request","key_findings":"Single-row PK lookup is fast but caching avoids round-trip entirely for repeat requests. Benchmark unaffected. Consistent with emoji caching pattern.","next_action":"Consider thread cache for ThreadBySlug/ThreadByID. Consider site cache if siteByKey cache is insufficient."}}
{"run":20,"commit":"aee14ed","metric":1657,"metrics":{"DeepReplies_µs":7922,"LargeNoViewer_µs":741,"LargeWithViewer_µs":1657,"MediumNoViewer_µs":736,"MediumWithViewer_µs":1500,"NewestSort_µs":867,"OldestSort_µs":949,"SmallNoViewer_µs":0,"SmallWithViewer_µs":0},"status":"keep","description":"Batch benchmark reaction setup inserts to reduce setup time from ~27s to ~15s (-44%). Compute final reaction_counts in Go instead of 600k individual UPSERTs. Benchmark metrics unchanged (setup is outside timer).","timestamp":1778923618081,"segment":0,"confidence":84.72958257713249,"asi":{"hypothesis":"individual INSERTs/UPSERTs in transaction are still slow for 1.2M rows","key_findings":"Batching reactions into chunks of 200 rows and computing counts in Go reduces setup from ~12s to ~3s. Total benchmark time drops 44%. Cleaner heap state may also improve measured metrics slightly.","next_action":"Batch votes setup similarly. Consider batching comment replies too."}}
{"run":21,"commit":"d30f1e2","metric":1649,"metrics":{"DeepReplies_µs":7763,"LargeNoViewer_µs":729,"LargeWithViewer_µs":1649,"MediumNoViewer_µs":721,"MediumWithViewer_µs":1479,"NewestSort_µs":858,"OldestSort_µs":919,"SmallNoViewer_µs":0,"SmallWithViewer_µs":0},"status":"keep","description":"Batch votes and comments setup in benchmark too. Total benchmark time drops to 13.4s. Measured metrics stable or slightly improved due to cleaner GC state.","timestamp":1778923719294,"segment":0,"confidence":83.09964412811388,"asi":{"hypothesis":"batching all setup inserts minimizes GC pressure before benchmark loop","key_findings":"Total benchmark time now 13.4s (down from 59s originally). All setup operations batched. Some metrics improved slightly likely due to less GC pressure from setup.","next_action":"Explore further app optimizations or wrap up session if diminishing returns."}}
{"run":22,"commit":"0fc1d0e","metric":1657,"metrics":{"DeepReplies_µs":7697,"LargeNoViewer_µs":730,"LargeWithViewer_µs":1657,"MediumNoViewer_µs":723,"MediumWithViewer_µs":1482,"NewestSort_µs":859,"OldestSort_µs":915,"SmallNoViewer_µs":0,"SmallWithViewer_µs":0},"status":"keep","description":"Remove dead code attachViewerVotes function (no longer called since votes are now fetched via LEFT JOIN in comment queries).","timestamp":1778924095564,"segment":0,"confidence":85.69174311926605,"asi":{"hypothesis":"dead code cleanup","key_findings":"attachViewerVotes was replaced by LEFT JOIN votes in comment queries. Removing it keeps the codebase clean. No performance impact."}}
